{"protocol":"v12-cross-run-publication-v3","language":"tr","surah":76,"ayat":[{"ayah_ref":"76:0","baseline":{"source_ref":"1:1","text":"Merhameti sınırsız, merhamet eden Allah'ın adıyla.","target_tokens":[["Merhameti",["1:1:3"]],["sınırsız",["1:1:3"]],["merhamet",["1:1:4"]],["eden",["1:1:4"]],["Allah'ın",["1:1:2"]],["adıyla",["1:1:1"]]]},"findings":[{"text":"Başlangıçtaki merhamet, insanın yaratılışından son ayette merhametin içine alınmasına kadar bütün süreci, ana rahmi gibi koruyup oluşuma imkân veren kuşatıcı bir alan olarak çerçeveler.","grade":"strong","anchors":[["1:1:3","root_000552",["B001","B003"]],["1:1:4","root_000552",["B001","B003"]]]},{"text":"Allah'ın adı, başlangıçta yalnızca söylenen bir ad değil, anılmaz durumdaki insanın anılan ve hatırlamakla yükümlü bir varlığa dönüşeceği bütün anlatının üzerine yükseltilen belirleyici addır.","grade":"strong","anchors":[["1:1:1","root_000745",["B005"]],["1:1:2","root_000047",["B001","B002"]]]}]},{"ayah_ref":"76:1","baseline":{"source_ref":"76:1","text":"İnsanın üzerinden, anılan bir şey olmadığı bir zaman dilimi geçti mi?","target_tokens":[["İnsanın",["76:1:4"]],["üzerinden",["76:1:3"]],["anılan",["76:1:11"]],["bir",["76:1:10"]],["şey",["76:1:10"]],["olmadığı",["76:1:8","76:1:9"]],["bir",["76:1:6"]],["zaman",["76:1:7"]],["dilimi",["76:1:5"]],["geçti",["76:1:2"]],["mi",["76:1:1"]]]},"findings":[{"text":"Zaman, insanın yokluğunu yalnızca ölçen boş bir süre değil, onun üzerinden geçen ve sonraki ağır gün tasvirlerinde baskısı açığa çıkan kuşatıcı bir güç olarak belirir.","grade":"strong","anchors":[["76:1:2","root_000009",["B001"]],["76:1:5","root_000382",["B001"]],["76:1:7","root_000494",["B001","B002"]]]},{"text":"İnsanın anılan bir şey hâline gelmesi, yalnız var olmaya değil, bilinip algılanabilen, hakkında konuşulabilen ve sorumluluk ilişkilerine girebilen görünür bir varlık olmaya geçiştir.","grade":"strong","anchors":[["76:1:4","root_000059",["B001","B002"]],["76:1:10","root_000831",["B001"]],["76:1:11","root_000516",["B003","B004"]]]}]},{"ayah_ref":"76:2","baseline":{"source_ref":"76:2","text":"Biz insanı karışık bir damladan, onu sınamak üzere yarattık; ardından onu işiten ve gören kıldık.","target_tokens":[["Biz",["76:2:1"]],["insanı",["76:2:3"]],["karışık",["76:2:6"]],["bir",["76:2:5"]],["damladan",["76:2:4","76:2:5"]],["onu",["76:2:7"]],["sınamak",["76:2:7"]],["üzere",["76:2:7"]],["yarattık",["76:2:2"]],["ardından",["76:2:8"]],["onu",["76:2:8"]],["işiten",["76:2:9"]],["ve",["76:2:9","76:2:10"]],["gören",["76:2:10"]],["kıldık",["76:2:8"]]]},"findings":[{"text":"Yaratma, karışık maddeyi ölçüp oranlayarak birbirine geçmiş unsurlardan tutarlı bir beden kuran ayarlı bir bileşim süreci olarak görünür.","grade":"strong","anchors":[["76:2:2","root_000434",["B001","B002"]],["76:2:6","root_001426",["B001","B004"]]]},{"text":"İşitme ve görme, sınamaya eşlik eden tarafsız yetiler değil, yolun ve sonuçların algılanmasını sağlayarak insanın durumunu açığa çıkaran sınama araçlarıdır.","grade":"strong","anchors":[["76:2:7","root_000153",["B002"]],["76:2:8","root_000248",["B002"]],["76:2:9","root_000741",["B001","B003"]],["76:2:10","root_000121",["B001","B002"]]]},{"text":"Karışık köken, sonucu önceden belirleyen bir madde değil, sınama yoluyla şükür ya da örtme yönünde açığa çıkacak iç karakter için katmanlı bir imkân alanıdır.","grade":"weak","anchors":[["76:2:2","root_000434",["B004"]],["76:2:6","root_001426",["B002","B003"]],["76:2:7","root_000153",["B002"]]]},{"text":"Daha sonraki inci benzetmesi, küçük sıvı başlangıçtan ışıldayan görünür biçime uzanan bir kök çağrışımı kurabilir; bu, damlanın inci olduğu anlamına gelmez.","grade":"reject","anchors":[["76:2:5","root_001518",["B001","B002"]]]}]},{"ayah_ref":"76:3","baseline":{"source_ref":"76:3","text":"Biz ona yolu gösterdik; ister şükreden ister nankör olsun.","target_tokens":[["Biz",["76:3:1"]],["ona",["76:3:2"]],["yolu",["76:3:3"]],["gösterdik",["76:3:2"]],["ister",["76:3:4"]],["şükreden",["76:3:5"]],["ister",["76:3:6"]],["nankör",["76:3:7"]],["olsun",["76:3:5","76:3:7"]]]},"findings":[{"text":"Doğru yola iletme, iki tepkiyi ortadan kaldırmaz; yürünebilir bir yönü önceden açar, fakat o yolun sonradan kişinin kendisi tarafından tutulması gerekir.","grade":"strong","anchors":[["76:3:2","root_001583",["B001","B002"]],["76:3:3","root_000672",["B001"]]]},{"text":"Şükür, az bir nimetin etkisini görünür kılıp başkalarına ulaştıran üretken bir tutumken nankörlük, açığa çıkarılmış nimeti ve doğruyu örten karşı süreçtir.","grade":"strong","anchors":[["76:3:5","root_000810",["B001","B002"]],["76:3:7","root_001307",["B001","B003","B004"]]]}]},{"ayah_ref":"76:4","baseline":{"source_ref":"76:4","text":"Biz inkâr edenler için zincirler, boyunduruklar ve alevli bir ateş hazırladık.","target_tokens":[["Biz",["76:4:1"]],["inkâr",["76:4:3"]],["edenler",["76:4:3"]],["için",["76:4:3"]],["zincirler",["76:4:4"]],["boyunduruklar",["76:4:5"]],["ve",["76:4:5","76:4:6"]],["alevli",["76:4:6"]],["bir",["76:4:6"]],["ateş",["76:4:6"]],["hazırladık",["76:4:2"]]]},"findings":[{"text":"Zincir, boyunduruk ve ateş; hareketi bağlayan, bedeni kapatan ve içeride sürekli yakıcı bir kışkırtma üreten tek bir kuşatma düzeni oluşturur.","grade":"strong","anchors":[["76:4:4","root_000731",["B002"]],["76:4:5","root_001102",["B006"]],["76:4:6","root_000708",["B001","B004"]]]},{"text":"Hareketi bağlayan zincir yapısı, daha sonra Selsebil adında duyulan kolay ve akıcı geçişle tersine çevrilir.","grade":"strong","anchors":[["76:4:4","root_000731",["B001","B002"]]]},{"text":"Bedeni kapatan boyunduruk, daha sonraki gümüş bilezikle aynı çevreleme hareketinin engelleyici bağdan onurlandırıcı süse dönüşen karşı kutbunu oluşturur.","grade":"weak","anchors":[["76:4:5","root_001102",["B006"]]]}]},{"ayah_ref":"76:5","baseline":{"source_ref":"76:5","text":"İyiler, karışımı kâfur olan bir kadehten içerler.","target_tokens":[["İyiler",["76:5:1","76:5:2"]],["karışımı",["76:5:7"]],["kâfur",["76:5:8"]],["olan",["76:5:6"]],["bir",["76:5:5"]],["kadehten",["76:5:4","76:5:5"]],["içerler",["76:5:3"]]]},"findings":[{"text":"İyilik, açıklanmamış bir statü değil; sonraki adak, doyurma ve karşılık beklememe eylemlerinde söz ile davranışı güvenilir biçimde tutarlı kılan etkin doğruluktur.","grade":"strong","anchors":[["76:5:2","root_000104",["B001","B002","B003"]]]},{"text":"Kadehin karışımı, yalnızca bir tat bileşimi değil, karışık bir kökenle başlayan bedenin sınanmış yönelişten sonra yararlı biçimde yeniden dengelenmesini düşündüren bir iç düzenlemedir.","grade":"weak","anchors":[["76:5:5","root_001277",["B001"]],["76:5:7","root_001417",["B001","B002"]]]},{"text":"Kâfur, hemen önceki inkâr edenlerle ortak kök alanını ahlaki örtmeden ferahlatıcı bir içecek bileşenine çeviren yerel bir karşıtlık kurar.","grade":"weak","anchors":[["76:5:8","root_001307",["B001","B003","B011"]]]}]},{"ayah_ref":"76:6","baseline":{"source_ref":"76:6","text":"Allah'ın kulları bir pınardan içer ve onu bol bol akıtırlar.","target_tokens":[["Allah'ın",["76:6:5"]],["kulları",["76:6:4"]],["bir",["76:6:1"]],["pınardan",["76:6:1","76:6:3"]],["içer",["76:6:2"]],["ve",["76:6:6"]],["onu",["76:6:6"]],["bol",["76:6:7"]],["bol",["76:6:7"]],["akıtırlar",["76:6:6"]]]},"findings":[{"text":"Kullar pınarın bağımsız kaynağı değil, Rabbin verdiği nimeti geniş kanallar açar gibi başkalarına ulaştıran etkin dağıtıcılardır; kulluk burada etkili aracılığı ortadan kaldırmaz.","grade":"strong","anchors":[["76:6:1","root_001069",["B006"]],["76:6:4","root_000973",["B003"]],["76:6:6","root_001132",["B001","B005"]],["76:6:7","root_001132",["B001","B005"]]]},{"text":"Su gözü, maddi bir pınar olmanın yanında, içenlerin gözetilip ihtiyaçlarının karşılandığını görünür kılan bir bakım odağı olarak da okunabilir.","grade":"weak","anchors":[["76:6:1","root_001069",["B003","B006"]]]}]},{"ayah_ref":"76:7","baseline":{"source_ref":"76:7","text":"Onlar adaklarını yerine getirir ve kötülüğü her yana yayılan bir günden korkarlar.","target_tokens":[["Onlar",["76:7:1"]],["adaklarını",["76:7:2"]],["yerine",["76:7:1"]],["getirir",["76:7:1"]],["ve",["76:7:3"]],["kötülüğü",["76:7:6"]],["her",["76:7:7"]],["yana",["76:7:7"]],["yayılan",["76:7:5","76:7:7"]],["bir",["76:7:4"]],["günden",["76:7:4"]],["korkarlar",["76:7:3"]]]},"findings":[{"text":"Adağı eksiksiz yerine getirmek, cezadaki zorla bağlanmanın karşısına kişinin kendisini isteyerek bağladığı ve sonuna kadar taşıdığı bir yükümlülük koyar.","grade":"strong","anchors":[["76:7:1","root_001669",["B001"]],["76:7:2","root_001488",["B002"]]]},{"text":"Korku, yayılan zararı önceden algılayıp bugünkü sadakati ve paylaşmayı harekete geçiren üretken bir öngörüdür; insanı eylemsiz bırakmaz.","grade":"strong","anchors":[["76:7:1","root_001669",["B001"]],["76:7:3","root_000447",["B001"]],["76:7:4","root_001700",["B003"]],["76:7:6","root_000787",["B001","B003"]],["76:7:7","root_000962",["B002"]]]}]},{"ayah_ref":"76:8","baseline":{"source_ref":"76:8","text":"Yemeği, sevdikleri hâlde yoksula, yetime ve esire yedirirler.","target_tokens":[["Yemeği",["76:8:2"]],["sevdikleri",["76:8:4"]],["hâlde",["76:8:3","76:8:4"]],["yoksula",["76:8:5"]],["yetime",["76:8:6"]],["ve",["76:8:7"]],["esire",["76:8:7"]],["yedirirler",["76:8:1"]]]},"findings":[{"text":"Tek bir yiyecek aktarımı, yoksulun durmuş imkânını, yetimin kesilmiş korumasını ve esirin zorla bağlanmışlığını hedefleyen üç ayrı toplumsal kopuşu kısmen onarır.","grade":"strong","anchors":[["76:8:1","root_000934",["B002","B004"]],["76:8:2","root_000934",["B002","B004"]],["76:8:5","root_000726",["B001","B006"]],["76:8:6","root_001692",["B001"]],["76:8:7","root_000030",["B001"]]]},{"text":"Esirin bağlanması, 28. ayette beden bağlarının güçlendirilmesiyle karşılaştırıldığında, aynı bağ kurma gücünün bedeni ayakta tutabileceği gibi kişiyi tutsak da edebileceğini gösterir.","grade":"weak","anchors":[["76:8:7","root_000030",["B001","B002"]]]}]},{"ayah_ref":"76:9","baseline":{"source_ref":"76:9","text":"Sizi yalnız Allah için doyuruyoruz. Sizden ne bir karşılık ne de teşek